[
  {
    "book": "1 Samuel",
    "chapter": 31,
    "verse": 8,
    "language_code": "en",
    "language_name": "English",
    "words": [
      {
        "position": 1,
        "surface": "וַֽ/יְהִי֙",
        "phrase": "And it was",
        "literal": "and-it-was",
        "source": "H1961 (KJV: 'it came to pass'; ESV/NASB: 'it came about')"
      },
      {
        "position": 2,
        "surface": "מִֽ/מָּחֳרָ֔ת",
        "phrase": "the next day",
        "literal": "from-tomorrow",
        "source": "H4283 (KJV: 'on the morrow'; ESV: 'the next day'; NASB: 'on the next day')"
      },
      {
        "position": 3,
        "surface": "וַ/יָּבֹ֣אוּ",
        "phrase": "and they came",
        "literal": "and-they-came",
        "source": "H935 (KJV/ESV/NASB: 'came')"
      },
      {
        "position": 4,
        "surface": "פְלִשְׁתִּ֔ים",
        "phrase": "Philistines",
        "literal": "Philistines",
        "source": "H6430 (KJV/ESV/NASB: 'Philistines')"
      },
      {
        "position": 5,
        "surface": "לְ/פַשֵּׁ֖ט",
        "phrase": "to strip",
        "literal": "to-strip",
        "source": "H6584 (KJV/ESV/NASB: 'to strip')"
      },
      {
        "position": 6,
        "surface": "אֶת",
        "phrase": "[direct object marker]",
        "literal": "[accusative]",
        "source": "H853 (KJV/ESV/NASB: 'the')"
      },
      {
        "position": 7,
        "surface": "הַ/חֲלָלִ֑ים",
        "phrase": "the slain",
        "literal": "the-slain",
        "source": "H2491 (KJV: 'the slain'; ESV: 'the dead'; NASB: 'those killed')"
      },
      {
        "position": 8,
        "surface": "וַֽ/יִּמְצְא֤וּ",
        "phrase": "and they found",
        "literal": "and-they-found",
        "source": "H4672 (KJV/ESV/NASB: 'found')"
      },
      {
        "position": 9,
        "surface": "אֶת",
        "phrase": "[direct object marker]",
        "literal": "[accusative]",
        "source": "H853 (KJV/ESV/NASB: ' ')"
      },
      {
        "position": 10,
        "surface": "שָׁאוּל֙",
        "phrase": "Saul",
        "literal": "Saul",
        "source": "H7586 (KJV/ESV/NASB: 'Saul')"
      },
      {
        "position": 11,
        "surface": "וְ/אֶת",
        "phrase": "and [direct object marker]",
        "literal": "and-[accusative]",
        "source": "H853 (KJV/ESV/NASB: 'and')"
      },
      {
        "position": 12,
        "surface": "שְׁלֹ֣שֶׁת",
        "phrase": "three",
        "literal": "three",
        "source": "H7969 (KJV/ESV/NASB: 'three')"
      },
      {
        "position": 13,
        "surface": "בָּנָ֔י/ו",
        "phrase": "his sons",
        "literal": "sons-his",
        "source": "H1121 (KJV/ESV/NASB: 'his sons')"
      },
      {
        "position": 14,
        "surface": "נֹפְלִ֖ים",
        "phrase": "fallen",
        "literal": "falling",
        "source": "H5307 (KJV/ESV/NASB: 'fallen')"
      },
      {
        "position": 15,
        "surface": "בְּ/הַ֥ר",
        "phrase": "on Mount",
        "literal": "in-the-mountain",
        "source": "H2022 (KJV/ESV/NASB: 'on mount')"
      },
      {
        "position": 16,
        "surface": "הַ/גִּלְבֹּֽעַ",
        "phrase": "Gilboa",
        "literal": "the-Gilboa",
        "source": "H1533 (KJV/ESV/NASB: 'Gilboa')"
      }
    ]
  }
]
