[
  {
    "book": "2 Samuel",
    "chapter": 22,
    "verse": 1,
    "language_code": "en",
    "language_name": "English",
    "words": [
      {
        "position": 1,
        "surface": "וַ/יְדַבֵּ֤ר",
        "phrase": "and spoke",
        "literal": "and-he-spoke",
        "source": "H1696; KJV: spake, ESV: spoke, NASB: spoke"
      },
      {
        "position": 2,
        "surface": "דָּוִד֙",
        "phrase": "David",
        "literal": "David",
        "source": "H1732; KJV: David, ESV: David, NASB: David"
      },
      {
        "position": 3,
        "surface": "לַֽ/יהוָ֔ה",
        "phrase": "to YHWH",
        "literal": "to-YHWH",
        "source": "H3068; KJV: unto the LORD, ESV: to the Lord, NASB: to the Lord"
      },
      {
        "position": 4,
        "surface": "אֶת",
        "phrase": "the",
        "literal": "[direct-object-marker]",
        "source": "H853; KJV: (implied), ESV: (implied), NASB: (implied)"
      },
      {
        "position": 5,
        "surface": "דִּבְרֵ֖י",
        "phrase": "words",
        "literal": "words-of",
        "source": "H1697; KJV: words, ESV: words, NASB: words"
      },
      {
        "position": 6,
        "surface": "הַ/שִּׁירָ֣ה",
        "phrase": "of the song",
        "literal": "the-song",
        "source": "H7892; KJV: song, ESV: song, NASB: song"
      },
      {
        "position": 7,
        "surface": "הַ/זֹּ֑את",
        "phrase": "this",
        "literal": "the-this",
        "source": "H2063; KJV: this, ESV: this, NASB: this"
      },
      {
        "position": 8,
        "surface": "בְּ/יוֹם֩",
        "phrase": "on day",
        "literal": "in-day",
        "source": "H3117; KJV: in the day, ESV: on the day, NASB: in the day"
      },
      {
        "position": 9,
        "surface": "הִצִּ֨יל",
        "phrase": "delivered",
        "literal": "he-delivered",
        "source": "H5337; KJV: had delivered, ESV: delivered, NASB: delivered"
      },
      {
        "position": 10,
        "surface": "יְהוָ֥ה",
        "phrase": "YHWH",
        "literal": "YHWH",
        "source": "H3068; KJV: the LORD, ESV: the Lord, NASB: the Lord"
      },
      {
        "position": 11,
        "surface": "אֹת֛/וֹ",
        "phrase": "him",
        "literal": "[dom]-him",
        "source": "H853; KJV: him, ESV: him, NASB: him"
      },
      {
        "position": 12,
        "surface": "מִ/כַּ֥ף",
        "phrase": "from hand",
        "literal": "from-hand",
        "source": "H3709; KJV: out of the hand, ESV: from the hand, NASB: from the hand"
      },
      {
        "position": 13,
        "surface": "כָּל",
        "phrase": "all",
        "literal": "all",
        "source": "H3605; KJV: all, ESV: all, NASB: all"
      },
      {
        "position": 14,
        "surface": "אֹיְבָ֖י/ו",
        "phrase": "his enemies",
        "literal": "enemies-his",
        "source": "H341; KJV: enemies, ESV: enemies, NASB: enemies"
      },
      {
        "position": 15,
        "surface": "וּ/מִ/כַּ֥ף",
        "phrase": "and from hand",
        "literal": "and-from-hand",
        "source": "H3709; KJV: and out of the hand, ESV: and from the hand, NASB: and from the hand"
      },
      {
        "position": 16,
        "surface": "שָׁאֽוּל",
        "phrase": "Saul",
        "literal": "Saul",
        "source": "H7586; KJV: Saul, ESV: Saul, NASB: Saul"
      }
    ]
  }
]
