[
  {
    "book": "Genesis",
    "chapter": 27,
    "verse": 27,
    "language_code": "en",
    "language_name": "English",
    "words": [
      {
        "position": 1,
        "surface": "וַיִּגַּשׁ",
        "phrase": "he came near",
        "literal": "and-he.drew.near",
        "source": "KJV, ESV, NASB"
      },
      {
        "position": 2,
        "surface": "וַיִּשַּׁק",
        "phrase": "and kissed",
        "literal": "and-he.kissed",
        "source": "KJV, ESV, NASB"
      },
      {
        "position": 3,
        "surface": "לוֹ",
        "phrase": "him",
        "literal": "to-him",
        "source": "KJV, ESV, NASB"
      },
      {
        "position": 4,
        "surface": "וַיָּרַח",
        "phrase": "and smelled",
        "literal": "and-he.smelled",
        "source": "KJV, ESV, NASB"
      },
      {
        "position": 5,
        "surface": "אֶת",
        "phrase": "[direct object marker]",
        "literal": "direct.object.marker",
        "source": "Standard Hebrew grammar particle"
      },
      {
        "position": 6,
        "surface": "רֵיחַ",
        "phrase": "the smell",
        "literal": "smell",
        "source": "KJV, ESV, NASB"
      },
      {
        "position": 7,
        "surface": "בְּגָדָיו",
        "phrase": "of his garments",
        "literal": "in-garments-his",
        "source": "KJV, ESV, NASB"
      },
      {
        "position": 8,
        "surface": "וַיְבָרֲכֵהוּ",
        "phrase": "and blessed him",
        "literal": "and-he.blessed-him",
        "source": "KJV, ESV, NASB"
      },
      {
        "position": 9,
        "surface": "וַיֹּאמֶר",
        "phrase": "and said",
        "literal": "and-he.said",
        "source": "KJV, ESV, NASB"
      },
      {
        "position": 10,
        "surface": "רְאֵה",
        "phrase": "See",
        "literal": "behold",
        "source": "KJV, ESV, NASB"
      },
      {
        "position": 11,
        "surface": "רֵיחַ",
        "phrase": "the smell",
        "literal": "smell",
        "source": "KJV, ESV, NASB"
      },
      {
        "position": 12,
        "surface": "בְּנִי",
        "phrase": "of my son",
        "literal": "of-son-my",
        "source": "KJV, ESV, NASB"
      },
      {
        "position": 13,
        "surface": "כְּרֵיחַ",
        "phrase": "is as the smell",
        "literal": "as-smell",
        "source": "KJV, ESV, NASB"
      },
      {
        "position": 14,
        "surface": "שָׂדֶה",
        "phrase": "of a field",
        "literal": "field",
        "source": "KJV, ESV, NASB"
      },
      {
        "position": 15,
        "surface": "אֲשֶׁר",
        "phrase": "which",
        "literal": "which",
        "source": "KJV, ESV, NASB"
      },
      {
        "position": 16,
        "surface": "בֵּרֲכוֹ",
        "phrase": "has blessed it",
        "literal": "blessed-it",
        "source": "KJV, ESV, NASB"
      },
      {
        "position": 17,
        "surface": "יְהוָה",
        "phrase": "the LORD",
        "literal": "YHWH",
        "source": "KJV, ESV, NASB"
      }
    ]
  }
]