[
  {
    "book": "2 Kings",
    "chapter": 10,
    "verse": 25,
    "language_code": "en",
    "language_name": "English",
    "words": [
      {
        "position": 1,
        "surface": "וַ/יְהִ֞י",
        "phrase": "And it was",
        "literal": "and-it-was",
        "source": "H1961 (KJV: came to pass; ESV: happened; NASB: came about)"
      },
      {
        "position": 2,
        "surface": "כְּ/כַלֹּת֣/וֹ",
        "phrase": "as he finished",
        "literal": "as-finishing-his",
        "source": "H3615 (KJV: made an end; ESV: finished; NASB: finished)"
      },
      {
        "position": 3,
        "surface": "לַ/עֲשׂ֣וֹת",
        "phrase": "of making",
        "literal": "to-make",
        "source": "H6213 (KJV: offering; ESV: offering; NASB: offering)"
      },
      {
        "position": 4,
        "surface": "הָ/עֹלָ֗ה",
        "phrase": "the burnt offering",
        "literal": "the-ascension-offering",
        "source": "H5930 (KJV: burnt offering; ESV: burnt offering; NASB: burnt offering)"
      },
      {
        "position": 5,
        "surface": "וַ/יֹּ֣אמֶר",
        "phrase": "and he said",
        "literal": "and-he-said",
        "source": "H559 (KJV: said; ESV: said; NASB: said)"
      },
      {
        "position": 6,
        "surface": "יֵ֠הוּא",
        "phrase": "Jehu",
        "literal": "Jehu",
        "source": "H3058 (KJV: Jehu; ESV: Jehu; NASB: Jehu)"
      },
      {
        "position": 7,
        "surface": "לָ/רָצִ֨ים",
        "phrase": "to the guards",
        "literal": "to-the-runners",
        "source": "H7323 (KJV: guard; ESV: guards; NASB: guard)"
      },
      {
        "position": 8,
        "surface": "וְ/לַ/שָּׁלִשִׁ֜ים",
        "phrase": "and to the officers",
        "literal": "and-to-the-thirds",
        "source": "H7991 (KJV: captains; ESV: officers; NASB: royal officers)"
      },
      {
        "position": 9,
        "surface": "בֹּ֤אוּ",
        "phrase": "Go in",
        "literal": "enter-ye",
        "source": "H935 (KJV: Go in; ESV: Go in; NASB: Go in)"
      },
      {
        "position": 10,
        "surface": "הַכּוּ/ם֙",
        "phrase": "kill them",
        "literal": "strike-ye-them",
        "source": "H5221 (KJV: slay them; ESV: kill them; NASB: kill them)"
      },
      {
        "position": 11,
        "surface": "אִ֣ישׁ",
        "phrase": "man",
        "literal": "man",
        "source": "H376 (KJV: none; ESV: one; NASB: none)"
      },
      {
        "position": 12,
        "surface": "אַל",
        "phrase": "not",
        "literal": "not",
        "source": "H408 (KJV: let none; ESV: let no; NASB: let none)"
      },
      {
        "position": 13,
        "surface": "יֵצֵ֔א",
        "phrase": "escape",
        "literal": "go-out",
        "source": "H3318 (KJV: come forth; ESV: escape; NASB: come out)"
      },
      {
        "position": 14,
        "surface": "וַ/יַּכּ֖וּ/ם",
        "phrase": "and they struck them",
        "literal": "and-they-struck-them",
        "source": "H5221 (KJV: smote them; ESV: cut them down; NASB: killed them)"
      },
      {
        "position": 15,
        "surface": "לְ/פִי",
        "phrase": "with the mouth of",
        "literal": "to-mouth-of",
        "source": "H6310 (KJV: edge; ESV: edge; NASB: edge)"
      },
      {
        "position": 16,
        "surface": "חָ֑רֶב",
        "phrase": "the sword",
        "literal": "sword",
        "source": "H2719 (KJV: sword; ESV: sword; NASB: sword)"
      },
      {
        "position": 17,
        "surface": "וַ/יַּשְׁלִ֗כוּ",
        "phrase": "and they threw",
        "literal": "and-they-cast",
        "source": "H7993 (KJV: cast them out; ESV: threw the bodies out; NASB: threw them out)"
      },
      {
        "position": 18,
        "surface": "הָֽ/רָצִים֙",
        "phrase": "the guards",
        "literal": "the-guards",
        "source": "H7323 (KJV: guard; ESV: guards; NASB: guard)"
      },
      {
        "position": 19,
        "surface": "וְ/הַ/שָּׁ֣לִשִׁ֔ים",
        "phrase": "and the officers",
        "literal": "and-the-officers",
        "source": "H7991 (KJV: captains; ESV: officers; NASB: royal officers)"
      },
      {
        "position": 20,
        "surface": "וַ/יֵּלְכ֖וּ",
        "phrase": "and went",
        "literal": "and-they-went",
        "source": "H3212 (KJV: went; ESV: entered; NASB: went)"
      },
      {
        "position": 21,
        "surface": "עַד",
        "phrase": "to",
        "literal": "to",
        "source": "H5704 (KJV: to; ESV: to; NASB: to)"
      },
      {
        "position": 22,
        "surface": "עִ֥יר",
        "phrase": "the inner part",
        "literal": "city",
        "source": "H5892 (KJV: city; ESV: inner room; NASB: inner room)"
      },
      {
        "position": 23,
        "surface": "בֵּית",
        "phrase": "of the house",
        "literal": "house",
        "source": "H1004 (KJV: house; ESV: temple; NASB: house)"
      },
      {
        "position": 24,
        "surface": "הַ/בָּֽעַל",
        "phrase": "of Baal",
        "literal": "the-Baal",
        "source": "H1168 (KJV: Baal; ESV: Baal; NASB: Baal)"
      }
    ]
  }
]
