[
  {
    "book": "1 Kings",
    "chapter": 3,
    "verse": 7,
    "language_code": "en",
    "language_name": "English",
    "words": [
      {
        "position": 1,
        "surface": "וְ/עַתָּה֙",
        "phrase": "And now",
        "literal": "and-now",
        "source": "H6258 (KJV: And now; ESV: And now; NASB: Now)"
      },
      {
        "position": 2,
        "surface": "יְהוָ֣ה",
        "phrase": "YHWH",
        "literal": "YHWH",
        "source": "H3068 (KJV: O LORD; ESV: O Lord; NASB: O LORD)"
      },
      {
        "position": 3,
        "surface": "אֱלֹהָ֔/י",
        "phrase": "my God",
        "literal": "God-my",
        "source": "H430 (KJV: my God; ESV: my God; NASB: my God)"
      },
      {
        "position": 4,
        "surface": "אַתָּה֙",
        "phrase": "you",
        "literal": "you",
        "source": "H859 (KJV: thou; ESV: you; NASB: You)"
      },
      {
        "position": 5,
        "surface": "הִמְלַ֣כְתָּ",
        "phrase": "have made king",
        "literal": "have-made-king",
        "source": "H4427 (KJV: hast made...king; ESV: have made...king; NASB: have made...king)"
      },
      {
        "position": 6,
        "surface": "אֶֽת",
        "phrase": "[direct object marker]",
        "literal": "[et]",
        "source": "H853 (KJV: [implied]; ESV: [implied]; NASB: [implied])"
      },
      {
        "position": 7,
        "surface": "עַבְדְּ/ךָ֔",
        "phrase": "your servant",
        "literal": "servant-your",
        "source": "H5650 (KJV: thy servant; ESV: your servant; NASB: Your servant)"
      },
      {
        "position": 8,
        "surface": "תַּ֖חַת",
        "phrase": "in place of",
        "literal": "under",
        "source": "H8478 (KJV: instead of; ESV: in place of; NASB: in place of)"
      },
      {
        "position": 9,
        "surface": "דָּוִ֣ד",
        "phrase": "David",
        "literal": "David",
        "source": "H1732 (KJV: David; ESV: David; NASB: David)"
      },
      {
        "position": 10,
        "surface": "אָבִ֑/י",
        "phrase": "my father",
        "literal": "father-my",
        "source": "H1 (KJV: my father; ESV: my father; NASB: my father)"
      },
      {
        "position": 11,
        "surface": "וְ/אָֽנֹכִי֙",
        "phrase": "and I",
        "literal": "and-I",
        "source": "H595 (KJV: and I; ESV: although I; NASB: yet I)"
      },
      {
        "position": 12,
        "surface": "נַ֣עַר",
        "phrase": "child",
        "literal": "youth",
        "source": "H5288 (KJV: a little child; ESV: a little child; NASB: a little child)"
      },
      {
        "position": 13,
        "surface": "קָטֹ֔ן",
        "phrase": "little",
        "literal": "small",
        "source": "H6996 (KJV: but a little; ESV: but a little; NASB: but a little)"
      },
      {
        "position": 14,
        "surface": "לֹ֥א",
        "phrase": "not",
        "literal": "not",
        "source": "H3808 (KJV: I know not; ESV: I do not know; NASB: I do not know)"
      },
      {
        "position": 15,
        "surface": "אֵדַ֖ע",
        "phrase": "I know",
        "literal": "I-know",
        "source": "H3045 (KJV: I know; ESV: I know; NASB: I know)"
      },
      {
        "position": 16,
        "surface": "צֵ֥את",
        "phrase": "to go out",
        "literal": "going-out",
        "source": "H3318 (KJV: how to go out; ESV: how to go out; NASB: how to go out)"
      },
      {
        "position": 17,
        "surface": "וָ/בֹֽא",
        "phrase": "or come in",
        "literal": "and-coming-in",
        "source": "H935 (KJV: or come in; ESV: or come in; NASB: or come in)"
      }
    ]
  }
]
