[
  {
    "book": "Deuteronomy",
    "chapter": 3,
    "verse": 27,
    "language_code": "en",
    "language_name": "English",
    "words": [
      {
        "position": 1,
        "surface": "עֲלֵ֣ה",
        "phrase": "go up",
        "literal": "go.up",
        "source": "H5927 (KJV: Go up; ESV: Go up; NASB: Go up)"
      },
      {
        "position": 2,
        "surface": "רֹ֣אשׁ",
        "phrase": "top",
        "literal": "head",
        "source": "H7218 (KJV: top; ESV: top; NASB: top)"
      },
      {
        "position": 3,
        "surface": "הַ/פִּסְגָּ֗ה",
        "phrase": "of Pisgah",
        "literal": "the/Pisgah",
        "source": "H6449 (KJV: Pisgah; ESV: Pisgah; NASB: Pisgah)"
      },
      {
        "position": 4,
        "surface": "וְ/שָׂ֥א",
        "phrase": "and lift",
        "literal": "and/lift",
        "source": "H5375 (KJV: lift up; ESV: lift up; NASB: lift up)"
      },
      {
        "position": 5,
        "surface": "עֵינֶ֛י/ךָ",
        "phrase": "your eyes",
        "literal": "eyes/your",
        "source": "H5869 (KJV: thine eyes; ESV: your eyes; NASB: your eyes)"
      },
      {
        "position": 6,
        "surface": "יָ֧מָּ/ה",
        "phrase": "westward",
        "literal": "sea/ward",
        "source": "H3220 (KJV: westward; ESV: westward; NASB: to the west)"
      },
      {
        "position": 7,
        "surface": "וְ/צָפֹ֛נָ/ה",
        "phrase": "and northward",
        "literal": "and/north/ward",
        "source": "H6828 (KJV: northward; ESV: northward; NASB: and north)"
      },
      {
        "position": 8,
        "surface": "וְ/תֵימָ֥נָ/ה",
        "phrase": "and southward",
        "literal": "and/south/ward",
        "source": "H8486 (KJV: southward; ESV: southward; NASB: and south)"
      },
      {
        "position": 9,
        "surface": "וּ/מִזְרָ֖חָ/ה",
        "phrase": "and eastward",
        "literal": "and/east/ward",
        "source": "H4217 (KJV: eastward; ESV: eastward; NASB: and east)"
      },
      {
        "position": 10,
        "surface": "וּ/רְאֵ֣ה",
        "phrase": "and see",
        "literal": "and/see",
        "source": "H7200 (KJV: behold; ESV: see; NASB: see)"
      },
      {
        "position": 11,
        "surface": "בְ/עֵינֶ֑י/ךָ",
        "phrase": "with your eyes",
        "literal": "in/eyes/your",
        "source": "H5869 (KJV: with thine eyes; ESV: with your eyes; NASB: with your eyes)"
      },
      {
        "position": 12,
        "surface": "כִּי",
        "phrase": "for",
        "literal": "for",
        "source": "H3588 (KJV: for; ESV: for; NASB: for)"
      },
      {
        "position": 13,
        "surface": "לֹ֥א",
        "phrase": "not",
        "literal": "not",
        "source": "H3808 (KJV: not; ESV: not; NASB: not)"
      },
      {
        "position": 14,
        "surface": "תַעֲבֹ֖ר",
        "phrase": "you shall cross",
        "literal": "you-will-cross",
        "source": "H5674 (KJV: go over; ESV: go over; NASB: cross over)"
      },
      {
        "position": 15,
        "surface": "אֶת",
        "phrase": "over",
        "literal": "direct.object.marker",
        "source": "H853 (KJV: [implied]; ESV: [implied]; NASB: [implied])"
      },
      {
        "position": 16,
        "surface": "הַ/יַּרְדֵּ֥ן",
        "phrase": "the Jordan",
        "literal": "the/Jordan",
        "source": "H3383 (KJV: Jordan; ESV: Jordan; NASB: Jordan)"
      },
      {
        "position": 17,
        "surface": "הַ/זֶּֽה",
        "phrase": "this",
        "literal": "the/this",
        "source": "H2088 (KJV: this; ESV: this; NASB: this)"
      }
    ]
  }
]
