[
  {
    "book": "1 Samuel",
    "chapter": 10,
    "verse": 9,
    "language_code": "en",
    "language_name": "English",
    "words": [
      {
        "position": 1,
        "surface": "וְ/הָיָ֗ה",
        "phrase": "And it was",
        "literal": "and-it-was",
        "source": "H1961; KJV: 'And it was so', ESV/NASB: 'Then it happened'"
      },
      {
        "position": 2,
        "surface": "כְּ/הַפְנֹת֤/וֹ",
        "phrase": "when he turned",
        "literal": "as-he-turned-him",
        "source": "H6437; KJV/ESV/NASB: 'his back' or 'turned his back'"
      },
      {
        "position": 3,
        "surface": "שִׁכְמ/וֹ֙",
        "phrase": "his shoulder",
        "literal": "shoulder-his",
        "source": "H7926; KJV/ESV/NASB: 'back' or 'shoulder'"
      },
      {
        "position": 4,
        "surface": "לָ/לֶ֨כֶת֙",
        "phrase": "to go",
        "literal": "to-go",
        "source": "H3212; KJV/ESV/NASB: 'to go'"
      },
      {
        "position": 5,
        "surface": "מֵ/עִ֣ם",
        "phrase": "from",
        "literal": "from-with",
        "source": "H5973; KJV/ESV/NASB: 'from'"
      },
      {
        "position": 6,
        "surface": "שְׁמוּאֵ֔ל",
        "phrase": "Samuel",
        "literal": "Samuel",
        "source": "H8050; KJV/ESV/NASB: 'Samuel'"
      },
      {
        "position": 7,
        "surface": "וַ/יַּהֲפָךְ",
        "phrase": "and God changed",
        "literal": "and-he-turned",
        "source": "H2015; KJV: 'gave', ESV/NASB: 'changed'"
      },
      {
        "position": 8,
        "surface": "ל֥/וֹ",
        "phrase": "for him",
        "literal": "to-him",
        "source": "-; KJV/ESV/NASB: 'him'"
      },
      {
        "position": 9,
        "surface": "אֱלֹהִ֖ים",
        "phrase": "God",
        "literal": "God",
        "source": "H430; KJV/ESV/NASB: 'God'"
      },
      {
        "position": 10,
        "surface": "לֵ֣ב",
        "phrase": "heart",
        "literal": "heart",
        "source": "H3820; KJV/ESV/NASB: 'heart'"
      },
      {
        "position": 11,
        "surface": "אַחֵ֑ר",
        "phrase": "another",
        "literal": "another",
        "source": "H312; KJV/ESV/NASB: 'another'"
      },
      {
        "position": 12,
        "surface": "וַ/יָּבֹ֛אוּ",
        "phrase": "and came",
        "literal": "and-they-came",
        "source": "H935; KJV/ESV/NASB: 'came to pass'"
      },
      {
        "position": 13,
        "surface": "כָּל",
        "phrase": "all",
        "literal": "all",
        "source": "H3605; KJV/ESV/NASB: 'all'"
      },
      {
        "position": 14,
        "surface": "הָ/אֹת֥וֹת",
        "phrase": "the signs",
        "literal": "the-signs",
        "source": "H226; KJV/ESV/NASB: 'those signs'"
      },
      {
        "position": 15,
        "surface": "הָ/אֵ֖לֶּה",
        "phrase": "these",
        "literal": "these",
        "source": "H428; KJV/ESV/NASB: 'those'"
      },
      {
        "position": 16,
        "surface": "בַּ/יּ֥וֹם",
        "phrase": "on the day",
        "literal": "in-the-day",
        "source": "H3117; KJV/ESV/NASB: 'that day'"
      },
      {
        "position": 17,
        "surface": "הַ/הֽוּא",
        "phrase": "that",
        "literal": "the-that",
        "source": "H1931; KJV/ESV/NASB: 'that'"
      }
    ]
  }
]
