[
  {
    "book": "Numbers",
    "chapter": 24,
    "verse": 7,
    "language_code": "en",
    "language_name": "English",
    "words": [
      {
        "position": 1,
        "surface": "יִֽזַּל",
        "phrase": "He shall pour/flow",
        "literal": "he-will-flow",
        "source": "H5140 (KJV: pour; ESV: flow; NASB: flow)"
      },
      {
        "position": 2,
        "surface": "מַ֨יִם֙",
        "phrase": "water",
        "literal": "water",
        "source": "H4325 (KJV: water; ESV: water; NASB: water)"
      },
      {
        "position": 3,
        "surface": "מִ/דָּ֣לְיָ֔/ו",
        "phrase": "from his buckets",
        "literal": "from-buckets-his",
        "source": "H1805 (KJV: buckets; ESV: buckets; NASB: buckets)"
      },
      {
        "position": 4,
        "surface": "וְ/זַרְע֖/וֹ",
        "phrase": "and his seed",
        "literal": "and-seed-his",
        "source": "H2233 (KJV: seed; ESV: seed; NASB: seed)"
      },
      {
        "position": 5,
        "surface": "בְּ/מַ֣יִם",
        "phrase": "in waters",
        "literal": "in-waters",
        "source": "H4325 (KJV: waters; ESV: waters; NASB: waters)"
      },
      {
        "position": 6,
        "surface": "רַבִּ֑ים",
        "phrase": "many",
        "literal": "many",
        "source": "H7227 (KJV: many; ESV: many; NASB: many)"
      },
      {
        "position": 7,
        "surface": "וְ/יָרֹ֤ם",
        "phrase": "and shall be higher",
        "literal": "and-he-will-be-high",
        "source": "H7311 (KJV: higher; ESV: higher; NASB: higher)"
      },
      {
        "position": 8,
        "surface": "מֵֽ/אֲגַג֙",
        "phrase": "than Agag",
        "literal": "than-Agag",
        "source": "H90 (KJV: Agag; ESV: Agag; NASB: Agag)"
      },
      {
        "position": 9,
        "surface": "מַלְכּ֔/וֹ",
        "phrase": "his king",
        "literal": "king-his",
        "source": "H4428 (KJV: king; ESV: king; NASB: king)"
      },
      {
        "position": 10,
        "surface": "וְ/תִנַּשֵּׂ֖א",
        "phrase": "and shall be exalted",
        "literal": "and-it-will-be-lifted",
        "source": "H5375 (KJV: exalted; ESV: exalted; NASB: exalted)"
      },
      {
        "position": 11,
        "surface": "מַלְכֻתֽ/וֹ",
        "phrase": "his kingdom",
        "literal": "kingdom-his",
        "source": "H4438 (KJV: kingdom; ESV: kingdom; NASB: kingdom)"
      }
    ]
  }
]
