[
  {
    "book": "Deuteronomy",
    "chapter": 18,
    "verse": 12,
    "language_code": "en",
    "language_name": "English",
    "words": [
      {
        "position": 1,
        "surface": "כִּֽי",
        "phrase": "for",
        "literal": "for",
        "source": "H3588 (KJV: For; ESV: for; NASB: For)"
      },
      {
        "position": 2,
        "surface": "תוֹעֲבַ֥ת",
        "phrase": "abomination",
        "literal": "abomination-of",
        "source": "H8441 (KJV: abomination; ESV: abomination; NASB: detestable)"
      },
      {
        "position": 3,
        "surface": "יְהוָ֖ה",
        "phrase": "YHWH",
        "literal": "YHWH",
        "source": "H3068 (KJV: LORD; ESV: LORD; NASB: LORD)"
      },
      {
        "position": 4,
        "surface": "כָּל",
        "phrase": "all",
        "literal": "all",
        "source": "H3605 (KJV: all; ESV: whoever; NASB: whoever)"
      },
      {
        "position": 5,
        "surface": "עֹ֣שֵׂה",
        "phrase": "doing",
        "literal": "doing",
        "source": "H6213 (KJV: do; ESV: does; NASB: does)"
      },
      {
        "position": 6,
        "surface": "אֵ֑לֶּה",
        "phrase": "these",
        "literal": "these",
        "source": "H428 (KJV: these things; ESV: these things; NASB: these things)"
      },
      {
        "position": 7,
        "surface": "וּ/בִ/גְלַל֙",
        "phrase": "and-because-of",
        "literal": "and-in-cause-of",
        "source": "H1558 (KJV: because of; ESV: because of; NASB: because of)"
      },
      {
        "position": 8,
        "surface": "הַ/תּוֹעֵבֹ֣ת",
        "phrase": "the-abominations",
        "literal": "the-abominations",
        "source": "H8441 (KJV: abominations; ESV: abominations; NASB: detestable things)"
      },
      {
        "position": 9,
        "surface": "הָ/אֵ֔לֶּה",
        "phrase": "these",
        "literal": "the-these",
        "source": "H428 (KJV: these; ESV: these; NASB: these)"
      },
      {
        "position": 10,
        "surface": "יְהוָ֣ה",
        "phrase": "YHWH",
        "literal": "YHWH",
        "source": "H3068 (KJV: LORD; ESV: LORD; NASB: LORD)"
      },
      {
        "position": 11,
        "surface": "אֱלֹהֶ֔י/ךָ",
        "phrase": "your-God",
        "literal": "God-your",
        "source": "H430 (KJV: thy God; ESV: your God; NASB: your God)"
      },
      {
        "position": 12,
        "surface": "מוֹרִ֥ישׁ",
        "phrase": "dispossessing",
        "literal": "dispossessing",
        "source": "H3423 (KJV: drive ... out; ESV: driving ... out; NASB: drive ... out)"
      },
      {
        "position": 13,
        "surface": "אוֹתָ֖/ם",
        "phrase": "them",
        "literal": "them",
        "source": "H853 (KJV: them; ESV: them; NASB: them)"
      },
      {
        "position": 14,
        "surface": "מִ/פָּנֶֽי/ךָ",
        "phrase": "from-before-you",
        "literal": "from-face-your",
        "source": "H6440 (KJV: from before thee; ESV: before you; NASB: before you)"
      }
    ]
  }
]
