[
  {
    "book": "Genesis",
    "chapter": 36,
    "verse": 30,
    "language_code": "en",
    "language_name": "English",
    "words": [
      {
        "position": 1,
        "surface": "אַלּ֥וּף",
        "phrase": "chief",
        "literal": "chief",
        "source": "KJV, ESV, NASB, NIV (duke/chief)"
      },
      {
        "position": 2,
        "surface": "דִּשֹׁ֛ן",
        "phrase": "Dishon",
        "literal": "Dishon",
        "source": "Proper name; KJV, ESV, NASB, NIV"
      },
      {
        "position": 3,
        "surface": "אַלּ֥וּף",
        "phrase": "chief",
        "literal": "chief",
        "source": "KJV, ESV, NASB, NIV (duke/chief)"
      },
      {
        "position": 4,
        "surface": "אֵ֖צֶר",
        "phrase": "Ezer",
        "literal": "Ezer",
        "source": "Proper name; KJV, ESV, NASB, NIV"
      },
      {
        "position": 5,
        "surface": "אַלּ֣וּף",
        "phrase": "chief",
        "literal": "chief",
        "source": "KJV, ESV, NASB, NIV (duke/chief)"
      },
      {
        "position": 6,
        "surface": "דִּישָׁ֑ן",
        "phrase": "Dishan",
        "literal": "Dishan",
        "source": "Proper name; KJV, ESV, NASB, NIV"
      },
      {
        "position": 7,
        "surface": "אֵ֣לֶּה",
        "phrase": "these",
        "literal": "these",
        "source": "Pronoun; KJV, ESV, NASB, NIV"
      },
      {
        "position": 8,
        "surface": "אַלּוּפֵ֧י",
        "phrase": "chiefs of",
        "literal": "chiefs-of",
        "source": "KJV (dukes), ESV, NASB, NIV (chiefs)"
      },
      {
        "position": 9,
        "surface": "הַ/חֹרִ֛י",
        "phrase": "the Horite",
        "literal": "the-Horite",
        "source": "KJV (Hori), ESV, NASB, NIV (Horites)"
      },
      {
        "position": 10,
        "surface": "לְ/אַלֻּפֵי/הֶ֖ם",
        "phrase": "according to their chiefs",
        "literal": "to-chiefs-their",
        "source": "ESV (chief by chief), NASB (various chiefs), NIV (divisions)"
      },
      {
        "position": 11,
        "surface": "בְּ/אֶ֥רֶץ",
        "phrase": "in the land",
        "literal": "in-land",
        "source": "Preposition + noun; KJV, ESV, NASB, NIV"
      },
      {
        "position": 12,
        "surface": "שֵׂעִֽיר",
        "phrase": "of Seir",
        "literal": "Seir",
        "source": "Proper name; KJV, ESV, NASB, NIV"
      }
    ]
  }
]