[
  {
    "book": "1 Samuel",
    "chapter": 12,
    "verse": 3,
    "language_code": "en",
    "language_name": "English",
    "words": [
      {
        "position": 1,
        "surface": "הִנְ/נִ֣י",
        "phrase": "here I am",
        "literal": "behold-I",
        "source": "H2005 (KJV: Behold, here I am; ESV: Here I am; NASB: Here I am)"
      },
      {
        "position": 2,
        "surface": "עֲנ֣וּ",
        "phrase": "testify",
        "literal": "answer!-2mp",
        "source": "H6030 (KJV: witness; ESV: testify; NASB: bear witness)"
      },
      {
        "position": 3,
        "surface": "בִ/י֩",
        "phrase": "against me",
        "literal": "in-me",
        "source": " (KJV: against me; ESV: against me; NASB: against me)"
      },
      {
        "position": 4,
        "surface": "נֶ֨גֶד",
        "phrase": "before",
        "literal": "before",
        "source": "H5048 (KJV: before; ESV: before; NASB: before)"
      },
      {
        "position": 5,
        "surface": "יְהוָ֜ה",
        "phrase": "YHWH",
        "literal": "YHWH",
        "source": "H3068 (KJV: the LORD; ESV: the Lord; NASB: the Lord)"
      },
      {
        "position": 6,
        "surface": "וְ/נֶ֣גֶד",
        "phrase": "and before",
        "literal": "and-before",
        "source": "H5048 (KJV: and before; ESV: and before; NASB: and before)"
      },
      {
        "position": 7,
        "surface": "מְשִׁיח֗/וֹ",
        "phrase": "his anointed",
        "literal": "his-anointed",
        "source": "H4899 (KJV: his anointed; ESV: his anointed; NASB: His anointed)"
      },
      {
        "position": 8,
        "surface": "אֶת",
        "phrase": "[direct object marker]",
        "literal": "[et]",
        "source": "H853 (KJV: [implied]; ESV: [implied]; NASB: [implied])"
      },
      {
        "position": 9,
        "surface": "שׁוֹר֩",
        "phrase": "ox",
        "literal": "ox",
        "source": "H7794 (KJV: ox; ESV: ox; NASB: ox)"
      },
      {
        "position": 10,
        "surface": "מִ֨י",
        "phrase": "whose",
        "literal": "who",
        "source": "H4310 (KJV: whose; ESV: Whose; NASB: Whose)"
      },
      {
        "position": 11,
        "surface": "לָקַ֜חְתִּי",
        "phrase": "have I taken",
        "literal": "I-have-taken",
        "source": "H3947 (KJV: have I taken; ESV: have I taken; NASB: have I taken)"
      },
      {
        "position": 12,
        "surface": "וַ/חֲמ֧וֹר",
        "phrase": "or donkey",
        "literal": "and-donkey",
        "source": "H2543 (KJV: ass; ESV: donkey; NASB: donkey)"
      },
      {
        "position": 13,
        "surface": "מִ֣י",
        "phrase": "whose",
        "literal": "who",
        "source": "H4310 (KJV: whose; ESV: whose; NASB: whose)"
      },
      {
        "position": 14,
        "surface": "לָקַ֗חְתִּי",
        "phrase": "have I taken",
        "literal": "I-have-taken",
        "source": "H3947 (KJV: have I taken; ESV: have I taken; NASB: have I taken)"
      },
      {
        "position": 15,
        "surface": "וְ/אֶת",
        "phrase": "or [et]",
        "literal": "and-[et]",
        "source": "H853 (KJV: or [implied]; ESV: Or; NASB: or)"
      },
      {
        "position": 16,
        "surface": "מִ֤י",
        "phrase": "whom",
        "literal": "who",
        "source": "H4310 (KJV: whom; ESV: whom; NASB: whom)"
      },
      {
        "position": 17,
        "surface": "עָשַׁ֨קְתִּי֙",
        "phrase": "have I oppressed",
        "literal": "I-have-oppressed",
        "source": "H6231 (KJV: oppressed; ESV: oppressed; NASB: oppressed)"
      },
      {
        "position": 18,
        "surface": "אֶת",
        "phrase": "[direct object marker]",
        "literal": "[et]",
        "source": "H853 (KJV: [implied]; ESV: [implied]; NASB: [implied])"
      },
      {
        "position": 19,
        "surface": "מִ֣י",
        "phrase": "whom",
        "literal": "who",
        "source": "H4310 (KJV: whom; ESV: Whom; NASB: whom)"
      },
      {
        "position": 20,
        "surface": "רַצּ֔וֹתִי",
        "phrase": "have I defrauded",
        "literal": "I-have-crushed",
        "source": "H7533 (KJV: defrauded; ESV: defrauded; NASB: defrauded)"
      },
      {
        "position": 21,
        "surface": "וּ/מִ/יַּד",
        "phrase": "or from hand",
        "literal": "and-from-hand",
        "source": "H3027 (KJV: of whose hand; ESV: from whose hand; NASB: from whose hand)"
      },
      {
        "position": 22,
        "surface": "מִי֙",
        "phrase": "whose",
        "literal": "who",
        "source": "H4310 (KJV: whose; ESV: whose; NASB: whose)"
      },
      {
        "position": 23,
        "surface": "לָקַ֣חְתִּי",
        "phrase": "have I taken",
        "literal": "I-have-taken",
        "source": "H3947 (KJV: received; ESV: taken; NASB: taken)"
      },
      {
        "position": 24,
        "surface": "כֹ֔פֶר",
        "phrase": "bribe",
        "literal": "ransom",
        "source": "H3724 (KJV: bribe; ESV: bribe; NASB: bribe)"
      },
      {
        "position": 25,
        "surface": "וְ/אַעְלִ֥ים",
        "phrase": "and I will blind",
        "literal": "and-I-will-blind",
        "source": "H5956 (KJV: to blind; ESV: to blind; NASB: to blind)"
      },
      {
        "position": 26,
        "surface": "עֵינַ֖/י",
        "phrase": "my eyes",
        "literal": "eye-my",
        "source": "H5869 (KJV: mine eyes; ESV: my eyes; NASB: my eyes)"
      },
      {
        "position": 27,
        "surface": "בּ֑/וֹ",
        "phrase": "with it",
        "literal": "in-it",
        "source": " (KJV: therewith; ESV: with it; NASB: with it)"
      },
      {
        "position": 28,
        "surface": "וְ/אָשִׁ֖יב",
        "phrase": "and I will restore",
        "literal": "and-I-will-return",
        "source": "H7725 (KJV: restore; ESV: restore; NASB: restore)"
      },
      {
        "position": 29,
        "surface": "לָ/כֶֽם",
        "phrase": "to you",
        "literal": "to-you",
        "source": " (KJV: you; ESV: to you; NASB: to you)"
      }
    ]
  }
]
