[
  {
    "book": "2 Samuel",
    "chapter": 19,
    "verse": 31,
    "language_code": "en",
    "language_name": "English",
    "words": [
      {
        "position": 1,
        "surface": "וַ/יֹּ֤אמֶר",
        "phrase": "and said",
        "literal": "and-he-said",
        "source": "H559 (KJV: said; ESV: said; NASB: said)"
      },
      {
        "position": 2,
        "surface": "מְפִיבֹ֨שֶׁת֙",
        "phrase": "Mephibosheth",
        "literal": "Mephibosheth",
        "source": "H4648 (KJV: Mephibosheth; ESV: Mephibosheth; NASB: Mephibosheth)"
      },
      {
        "position": 3,
        "surface": "אֶל",
        "phrase": "to",
        "literal": "to",
        "source": "H413 (KJV: unto; ESV: to; NASB: to)"
      },
      {
        "position": 4,
        "surface": "הַ/מֶּ֔לֶךְ",
        "phrase": "the king",
        "literal": "the-king",
        "source": "H4428 (KJV: the king; ESV: the king; NASB: the king)"
      },
      {
        "position": 5,
        "surface": "גַּ֥ם",
        "phrase": "also",
        "literal": "also",
        "source": "H1571 (KJV: yea; ESV: yes; NASB: yes)"
      },
      {
        "position": 6,
        "surface": "אֶת",
        "phrase": "[direct object marker]",
        "literal": "[et]",
        "source": "H853 (KJV: (implied); ESV: (implied); NASB: (implied))"
      },
      {
        "position": 7,
        "surface": "הַ/כֹּ֖ל",
        "phrase": "all",
        "literal": "the-all",
        "source": "H3605 (KJV: all; ESV: all; NASB: all)"
      },
      {
        "position": 8,
        "surface": "יִקָּ֑ח",
        "phrase": "let him take",
        "literal": "he-may-take",
        "source": "H3947 (KJV: take; ESV: take; NASB: take)"
      },
      {
        "position": 9,
        "surface": "אַ֠חֲרֵי",
        "phrase": "after",
        "literal": "after",
        "source": "H310 (KJV: forasmuch as; ESV: for; NASB: since)"
      },
      {
        "position": 10,
        "surface": "אֲשֶׁר",
        "phrase": "that",
        "literal": "that",
        "source": "H834 (KJV: as; ESV: as; NASB: that)"
      },
      {
        "position": 11,
        "surface": "בָּ֞א",
        "phrase": "has come",
        "literal": "he-came",
        "source": "H935 (KJV: is come; ESV: has come; NASB: has come)"
      },
      {
        "position": 12,
        "surface": "אֲדֹנִ֥/י",
        "phrase": "my lord",
        "literal": "my-lord",
        "source": "H113 (KJV: my lord; ESV: my lord; NASB: my lord)"
      },
      {
        "position": 13,
        "surface": "הַ/מֶּ֛לֶך",
        "phrase": "the king",
        "literal": "the-king",
        "source": "H4428 (KJV: the king; ESV: the king; NASB: the king)"
      },
      {
        "position": 14,
        "surface": "בְּ/שָׁל֖וֹם",
        "phrase": "in peace",
        "literal": "in-peace",
        "source": "H7965 (KJV: in peace; ESV: in peace; NASB: in peace)"
      },
      {
        "position": 15,
        "surface": "אֶל",
        "phrase": "to",
        "literal": "to",
        "source": "H413 (KJV: unto; ESV: to; NASB: to)"
      },
      {
        "position": 16,
        "surface": "בֵּיתֽ/וֹ",
        "phrase": "his house",
        "literal": "house-his",
        "source": "H1004 (KJV: his house; ESV: his house; NASB: his house)"
      }
    ]
  }
]
