[
  {
    "book": "Numbers",
    "chapter": 27,
    "verse": 1,
    "language_code": "en",
    "language_name": "English",
    "words": [
      {
        "position": 1,
        "surface": "וַ/תִּקְרַ֜בְנָה",
        "phrase": "Then drew near",
        "literal": "and-they-drew-near",
        "source": "H7126 (KJV: came; ESV: drew near; NASB: came near)"
      },
      {
        "position": 2,
        "surface": "בְּנ֣וֹת",
        "phrase": "the daughters",
        "literal": "daughters-of",
        "source": "H1323 (KJV: daughters; ESV: daughters; NASB: daughters)"
      },
      {
        "position": 3,
        "surface": "צְלָפְחָ֗ד",
        "phrase": "of Zelophehad",
        "literal": "Zelophehad",
        "source": "H6765 (KJV: Zelophehad; ESV: Zelophehad; NASB: Zelophehad)"
      },
      {
        "position": 4,
        "surface": "בֶּן",
        "phrase": "the son",
        "literal": "son-of",
        "source": "H1121 (KJV: son; ESV: son; NASB: son)"
      },
      {
        "position": 5,
        "surface": "חֵ֤פֶר",
        "phrase": "of Hepher",
        "literal": "Hepher",
        "source": "H2660 (KJV: Hepher; ESV: Hepher; NASB: Hepher)"
      },
      {
        "position": 6,
        "surface": "בֶּן",
        "phrase": "son",
        "literal": "son-of",
        "source": "H1121 (KJV: son; ESV: son; NASB: son)"
      },
      {
        "position": 7,
        "surface": "גִּלְעָד֙",
        "phrase": "of Gilead",
        "literal": "Gilead",
        "source": "H1568 (KJV: Gilead; ESV: Gilead; NASB: Gilead)"
      },
      {
        "position": 8,
        "surface": "בֶּן",
        "phrase": "son",
        "literal": "son-of",
        "source": "H1121 (KJV: son; ESV: son; NASB: son)"
      },
      {
        "position": 9,
        "surface": "מָכִ֣יר",
        "phrase": "of Machir",
        "literal": "Machir",
        "source": "H4353 (KJV: Machir; ESV: Machir; NASB: Machir)"
      },
      {
        "position": 10,
        "surface": "בֶּן",
        "phrase": "son",
        "literal": "son-of",
        "source": "H1121 (KJV: son; ESV: son; NASB: son)"
      },
      {
        "position": 11,
        "surface": "מְנַשֶּׁ֔ה",
        "phrase": "of Manasseh",
        "literal": "Manasseh",
        "source": "H4519 (KJV: Manasseh; ESV: Manasseh; NASB: Manasseh)"
      },
      {
        "position": 12,
        "surface": "לְ/מִשְׁפְּחֹ֖ת",
        "phrase": "from the families",
        "literal": "to-families-of",
        "source": "H4940 (KJV: families; ESV: clans; NASB: families)"
      },
      {
        "position": 13,
        "surface": "מְנַשֶּׁ֣ה",
        "phrase": "of Manasseh",
        "literal": "Manasseh",
        "source": "H4519 (KJV: Manasseh; ESV: Manasseh; NASB: Manasseh)"
      },
      {
        "position": 14,
        "surface": "בֶן",
        "phrase": "the son",
        "literal": "son-of",
        "source": "H1121 (KJV: son; ESV: son; NASB: son)"
      },
      {
        "position": 15,
        "surface": "יוֹסֵ֑ף",
        "phrase": "of Joseph",
        "literal": "Joseph",
        "source": "H3130 (KJV: Joseph; ESV: Joseph; NASB: Joseph)"
      },
      {
        "position": 16,
        "surface": "וְ/אֵ֨לֶּה֙",
        "phrase": "and these",
        "literal": "and-these",
        "source": "H428 (KJV: these; ESV: these; NASB: these)"
      },
      {
        "position": 17,
        "surface": "שְׁמ֣וֹת",
        "phrase": "the names",
        "literal": "names-of",
        "source": "H8034 (KJV: names; ESV: names; NASB: names)"
      },
      {
        "position": 18,
        "surface": "בְּנֹתָ֔י/ו",
        "phrase": "of his daughters",
        "literal": "daughters-his",
        "source": "H1323 (KJV: daughters; ESV: daughters; NASB: daughters)"
      },
      {
        "position": 19,
        "surface": "מַחְלָ֣ה",
        "phrase": "Mahlah",
        "literal": "Mahlah",
        "source": "H4244 (KJV: Mahlah; ESV: Mahlah; NASB: Mahlah)"
      },
      {
        "position": 20,
        "surface": "נֹעָ֔ה",
        "phrase": "Noah",
        "literal": "Noah",
        "source": "H5270 (KJV: Noah; ESV: Noah; NASB: Noah)"
      },
      {
        "position": 21,
        "surface": "וְ/חָגְלָ֥ה",
        "phrase": "Hoglah",
        "literal": "and-Hoglah",
        "source": "H2295 (KJV: Hoglah; ESV: Hoglah; NASB: Hoglah)"
      },
      {
        "position": 22,
        "surface": "וּ/מִלְכָּ֖ה",
        "phrase": "Milcah",
        "literal": "and-Milcah",
        "source": "H4435 (KJV: Milcah; ESV: Milcah; NASB: Milcah)"
      },
      {
        "position": 23,
        "surface": "וְ/תִרְצָֽה",
        "phrase": "and Tirzah",
        "literal": "and-Tirzah",
        "source": "H8656 (KJV: Tirzah; ESV: Tirzah; NASB: Tirzah)"
      }
    ]
  }
]
