[
  {
    "book": "Leviticus",
    "chapter": 11,
    "verse": 10,
    "language_code": "en",
    "language_name": "English",
    "words": [
      {
        "position": 1,
        "surface": "וְ/כֹל֩",
        "phrase": "and every",
        "literal": "and-all",
        "source": "H3605; KJV: all; ESV: everything; NASB: all"
      },
      {
        "position": 2,
        "surface": "אֲשֶׁ֨ר",
        "phrase": "that",
        "literal": "which",
        "source": "H834; KJV: which; ESV: that; NASB: that"
      },
      {
        "position": 3,
        "surface": "אֵֽין",
        "phrase": "not",
        "literal": "not",
        "source": "H369; KJV: no; ESV: does not have; NASB: does not have"
      },
      {
        "position": 4,
        "surface": "ל֜/וֹ",
        "phrase": "to it",
        "literal": "to-it",
        "source": "-; KJV: have; ESV: have; NASB: have"
      },
      {
        "position": 5,
        "surface": "סְנַפִּ֣יר",
        "phrase": "fins",
        "literal": "fin",
        "source": "H5579; KJV: fins; ESV: fins; NASB: fins"
      },
      {
        "position": 6,
        "surface": "וְ/קַשְׂקֶ֗שֶׂת",
        "phrase": "and scales",
        "literal": "and-scale",
        "source": "H7193; KJV: scales; ESV: scales; NASB: scales"
      },
      {
        "position": 7,
        "surface": "בַּ/יַּמִּים֙",
        "phrase": "in the seas",
        "literal": "in-the-seas",
        "source": "H3220; KJV: seas; ESV: seas; NASB: seas"
      },
      {
        "position": 8,
        "surface": "וּ/בַ/נְּחָלִ֔ים",
        "phrase": "and in the streams",
        "literal": "and-in-the-streams",
        "source": "H5158; KJV: rivers; ESV: streams; NASB: streams"
      },
      {
        "position": 9,
        "surface": "מִ/כֹּל֙",
        "phrase": "from all",
        "literal": "from-all",
        "source": "H3605; KJV: among; ESV: among; NASB: among"
      },
      {
        "position": 10,
        "surface": "שֶׁ֣רֶץ",
        "phrase": "swarming thing",
        "literal": "swarmer",
        "source": "H8318; KJV: creeping; ESV: swarming things; NASB: swarming things"
      },
      {
        "position": 11,
        "surface": "הַ/מַּ֔יִם",
        "phrase": "of the waters",
        "literal": "the-waters",
        "source": "H4325; KJV: waters; ESV: water; NASB: water"
      },
      {
        "position": 12,
        "surface": "וּ/מִ/כֹּ֛ל",
        "phrase": "and from all",
        "literal": "and-from-all",
        "source": "H3605; KJV: among; ESV: among; NASB: among"
      },
      {
        "position": 13,
        "surface": "נֶ֥פֶשׁ",
        "phrase": "living creature",
        "literal": "soul",
        "source": "H5315; KJV: living thing; ESV: living creatures; NASB: living creatures"
      },
      {
        "position": 14,
        "surface": "הַ/חַיָּ֖ה",
        "phrase": "that moves",
        "literal": "the-life",
        "source": "H2416; KJV: that moveth; ESV: that moves; NASB: that moves"
      },
      {
        "position": 15,
        "surface": "אֲשֶׁ֣ר",
        "phrase": "that",
        "literal": "which",
        "source": "H834; KJV: which; ESV: that; NASB: that"
      },
      {
        "position": 16,
        "surface": "בַּ/מָּ֑יִם",
        "phrase": "in the waters",
        "literal": "in-the-waters",
        "source": "H4325; KJV: waters; ESV: water; NASB: water"
      },
      {
        "position": 17,
        "surface": "שֶׁ֥קֶץ",
        "phrase": "detestable",
        "literal": "detestable-thing",
        "source": "H8263; KJV: abomination; ESV: detestable; NASB: detestable"
      },
      {
        "position": 18,
        "surface": "הֵ֖ם",
        "phrase": "they",
        "literal": "they",
        "source": "H1992; KJV: they; ESV: they; NASB: they"
      },
      {
        "position": 19,
        "surface": "לָ/כֶֽם",
        "phrase": "to you",
        "literal": "to-you(pl)",
        "source": "-; KJV: unto you; ESV: to you; NASB: to you"
      }
    ]
  }
]
