[
  {
    "book": "Exodus",
    "chapter": 8,
    "verse": 13,
    "language_code": "en",
    "language_name": "English",
    "words": [
      {
        "position": 1,
        "surface": "וַ/יַּֽעֲשׂוּ",
        "phrase": "And they did",
        "literal": "and-they-did",
        "source": "H6213 wayyiqtol 3mp Qal of עָשָׂה 'to do, make'; KJV 'did', ESV 'did', NASB 'did'"
      },
      {
        "position": 2,
        "surface": "כֵ֗ן",
        "phrase": "so",
        "literal": "so",
        "source": "H3651 adv. ken 'so, thus'; KJV 'so', ESV 'so', NASB 'so'"
      },
      {
        "position": 3,
        "surface": "וַ/יֵּט֩",
        "phrase": "and stretched out",
        "literal": "and-he-stretched-out",
        "source": "H5186 wayyiqtol 3ms Qal of נָטָה 'to stretch out'; KJV 'stretched out', ESV 'stretched out', NASB 'stretched out'"
      },
      {
        "position": 4,
        "surface": "אַהֲרֹ֨ן",
        "phrase": "Aaron",
        "literal": "Aaron",
        "source": "H175 proper name; all trans. agree"
      },
      {
        "position": 5,
        "surface": "אֶת",
        "phrase": "[direct object marker]",
        "literal": "DOM",
        "source": "H853 direct object marker; untranslated in English"
      },
      {
        "position": 6,
        "surface": "יָד֤/וֹ",
        "phrase": "his hand",
        "literal": "hand-his",
        "source": "H3027 n.fs construct yad 'hand' + 3ms suff.; KJV 'his hand', ESV 'his hand', NASB 'his hand'"
      },
      {
        "position": 7,
        "surface": "בְ/מַטֵּ֨/הוּ֙",
        "phrase": "with his staff",
        "literal": "with-staff-his",
        "source": "H4294 prep. b- + n.ms construct matteh 'staff, rod' + 3ms suff.; KJV 'with his rod', ESV 'with his staff', NASB 'with his staff'"
      },
      {
        "position": 8,
        "surface": "וַ/יַּךְ֙",
        "phrase": "and struck",
        "literal": "and-he-struck",
        "source": "H5221 wayyiqtol 3ms Hiphil of נָכָה 'to strike'; KJV 'smote', ESV 'struck', NASB 'struck'"
      },
      {
        "position": 9,
        "surface": "אֶת",
        "phrase": "[direct object marker]",
        "literal": "DOM",
        "source": "H853 direct object marker; untranslated in English"
      },
      {
        "position": 10,
        "surface": "עֲפַ֣ר",
        "phrase": "the dust of",
        "literal": "dust-of",
        "source": "H6083 n.ms construct ʿaphar 'dust'; KJV 'the dust', ESV 'the dust', NASB 'the dust'"
      },
      {
        "position": 11,
        "surface": "הָ/אָ֔רֶץ",
        "phrase": "the earth",
        "literal": "the-earth",
        "source": "H776 art. + n.fs ʾerets 'land, earth'; KJV 'the earth', ESV 'the earth', NASB 'the earth'"
      },
      {
        "position": 12,
        "surface": "וַ/תְּהִי֙",
        "phrase": "and there were",
        "literal": "and-it-became",
        "source": "H1961 wayyiqtol 3fs Qal of הָיָה 'to be, become'; KJV 'it became', ESV 'there were', NASB 'there were'"
      },
      {
        "position": 13,
        "surface": "הַ/כִּנָּ֔ם",
        "phrase": "gnats",
        "literal": "the-gnats",
        "source": "H3654 art. + n.ms kinnam 'gnat, louse' (collective); KJV 'lice', ESV 'gnats', NASB 'gnats'"
      },
      {
        "position": 14,
        "surface": "בָּ/אָדָ֖ם",
        "phrase": "on man",
        "literal": "on-the-man",
        "source": "H120 prep. b- + art. + n.ms ʾadam 'man, mankind'; KJV 'in man', ESV 'on man', NASB 'on man'"
      },
      {
        "position": 15,
        "surface": "וּ/בַ/בְּהֵמָ֑ה",
        "phrase": "and on beast",
        "literal": "and-on-the-beast",
        "source": "H929 conj. + prep. b- + art. + n.fs behemah 'beast, animal'; KJV 'and in beast', ESV 'and on beast', NASB 'and on beast'"
      },
      {
        "position": 16,
        "surface": "כָּל",
        "phrase": "all",
        "literal": "all-of",
        "source": "H3605 n.ms construct kol 'all, every'; KJV 'all', ESV 'all', NASB 'all'"
      },
      {
        "position": 17,
        "surface": "עֲפַ֥ר",
        "phrase": "the dust of",
        "literal": "dust-of",
        "source": "H6083 n.ms construct ʿaphar 'dust'; KJV 'the dust', ESV 'the dust', NASB 'the dust'"
      },
      {
        "position": 18,
        "surface": "הָ/אָ֛רֶץ",
        "phrase": "the earth",
        "literal": "the-earth",
        "source": "H776 art. + n.fs ʾerets 'land, earth'; KJV 'the land', ESV 'the earth', NASB 'the earth'"
      },
      {
        "position": 19,
        "surface": "הָיָ֥ה",
        "phrase": "became",
        "literal": "it-became",
        "source": "H1961 Qal perf. 3ms of הָיָה 'to be, become'; KJV 'became', ESV 'became', NASB 'became'"
      },
      {
        "position": 20,
        "surface": "כִנִּ֖ים",
        "phrase": "gnats",
        "literal": "gnats",
        "source": "H3654 n.mp kinnim 'gnat, louse'; KJV 'lice', ESV 'gnats', NASB 'gnats'"
      },
      {
        "position": 21,
        "surface": "בְּ/כָל",
        "phrase": "in all",
        "literal": "in-all-of",
        "source": "H3605 prep. b- + n.ms construct kol 'all, every'; KJV 'throughout all', ESV 'throughout all', NASB 'throughout all'"
      },
      {
        "position": 22,
        "surface": "אֶ֥רֶץ",
        "phrase": "the land of",
        "literal": "land-of",
        "source": "H776 n.fs construct ʾerets 'land, earth'; KJV 'the land', ESV 'the land', NASB 'the land'"
      },
      {
        "position": 23,
        "surface": "מִצְרָֽיִם",
        "phrase": "Egypt",
        "literal": "Egypt",
        "source": "H4714 proper name Mitsrayim 'Egypt'; all trans. agree"
      }
    ]
  }
]
