[
  {
    "book": "1 Kings",
    "chapter": 15,
    "verse": 20,
    "language_code": "en",
    "language_name": "English",
    "words": [
      {
        "position": 1,
        "surface": "וַ/יִּשְׁמַ֨ע",
        "phrase": "and he heard",
        "literal": "and-he-heard",
        "source": "H8085 (KJV: hearkened; ESV: listened; NASB: listened)"
      },
      {
        "position": 2,
        "surface": "בֶּן",
        "phrase": "son of",
        "literal": "son",
        "source": "H1121 (KJV: Ben-hadad; ESV: Ben-hadad; NASB: Ben-hadad)"
      },
      {
        "position": 3,
        "surface": "הֲדַ֜ד",
        "phrase": "Hadad",
        "literal": "Hadad",
        "source": "H1908 (KJV: Ben-hadad; ESV: Ben-hadad; NASB: Ben-hadad)"
      },
      {
        "position": 4,
        "surface": "אֶל",
        "phrase": "to",
        "literal": "to",
        "source": "H413 (KJV: unto; ESV: to; NASB: to)"
      },
      {
        "position": 5,
        "surface": "הַ/מֶּ֣לֶךְ",
        "phrase": "the king",
        "literal": "the-king",
        "source": "H4428 (KJV: king; ESV: King; NASB: king)"
      },
      {
        "position": 6,
        "surface": "אָסָ֗א",
        "phrase": "Asa",
        "literal": "Asa",
        "source": "H609 (KJV: Asa; ESV: Asa; NASB: Asa)"
      },
      {
        "position": 7,
        "surface": "וַ֠/יִּשְׁלַח",
        "phrase": "and he sent",
        "literal": "and-he-sent",
        "source": "H7971 (KJV: sent; ESV: sent; NASB: sent)"
      },
      {
        "position": 8,
        "surface": "אֶת",
        "phrase": "[direct object marker]",
        "literal": "[et]",
        "source": "H853 (KJV: -; ESV: -; NASB: -)"
      },
      {
        "position": 9,
        "surface": "שָׂרֵ֨י",
        "phrase": "captains of",
        "literal": "captains-of",
        "source": "H8269 (KJV: captains; ESV: commanders; NASB: commanders)"
      },
      {
        "position": 10,
        "surface": "הַ/חֲיָלִ֤ים",
        "phrase": "the forces",
        "literal": "the-forces",
        "source": "H2428 (KJV: hosts; ESV: armies; NASB: armies)"
      },
      {
        "position": 11,
        "surface": "אֲשֶׁר",
        "phrase": "which",
        "literal": "which",
        "source": "H834 (KJV: which; ESV: of his; NASB: of his)"
      },
      {
        "position": 12,
        "surface": "ל/וֹ֙",
        "phrase": "he had",
        "literal": "to-him",
        "source": "- (KJV: he had; ESV: his; NASB: his)"
      },
      {
        "position": 13,
        "surface": "עַל",
        "phrase": "against",
        "literal": "upon",
        "source": "H5921 (KJV: against; ESV: against; NASB: against)"
      },
      {
        "position": 14,
        "surface": "עָרֵ֣י",
        "phrase": "cities of",
        "literal": "cities-of",
        "source": "H5892 (KJV: cities; ESV: cities; NASB: towns)"
      },
      {
        "position": 15,
        "surface": "יִשְׂרָאֵ֔ל",
        "phrase": "Israel",
        "literal": "Israel",
        "source": "H3478 (KJV: Israel; ESV: Israel; NASB: Israel)"
      },
      {
        "position": 16,
        "surface": "וַ/יַּךְ֙",
        "phrase": "and he struck",
        "literal": "and-he-struck",
        "source": "H5221 (KJV: smote; ESV: attacked; NASB: struck)"
      },
      {
        "position": 17,
        "surface": "אֶת",
        "phrase": "[direct object marker]",
        "literal": "[et]",
        "source": "H853 (KJV: -; ESV: -; NASB: -)"
      },
      {
        "position": 18,
        "surface": "עִיּ֣וֹן",
        "phrase": "Ijon",
        "literal": "Ijon",
        "source": "H5859 (KJV: Ijon; ESV: Ijon; NASB: Ijon)"
      },
      {
        "position": 19,
        "surface": "וְ/אֶת",
        "phrase": "and [direct object marker]",
        "literal": "and-[et]",
        "source": "H853 (KJV: and; ESV: and; NASB: and)"
      },
      {
        "position": 20,
        "surface": "דָּ֔ן",
        "phrase": "Dan",
        "literal": "Dan",
        "source": "H1835 (KJV: Dan; ESV: Dan; NASB: Dan)"
      },
      {
        "position": 21,
        "surface": "וְ/אֵ֖ת",
        "phrase": "and [direct object marker]",
        "literal": "and-[et]",
        "source": "H853 (KJV: and; ESV: and; NASB: and)"
      },
      {
        "position": 22,
        "surface": "אָבֵ֣ל",
        "phrase": "Abel",
        "literal": "Abel",
        "source": "H62 (KJV: Abel; ESV: Abel; NASB: Abel)"
      },
      {
        "position": 23,
        "surface": "בֵּֽית",
        "phrase": "of Beth",
        "literal": "house-of",
        "source": "H1004 (KJV: beth; ESV: beth; NASB: beth)"
      },
      {
        "position": 24,
        "surface": "מַעֲכָ֑ה",
        "phrase": "Maacah",
        "literal": "Maacah",
        "source": "H4619 (KJV: Maachah; ESV: Maacah; NASB: Maacah)"
      },
      {
        "position": 25,
        "surface": "וְ/אֵ֙ת֙",
        "phrase": "and [direct object marker]",
        "literal": "and-[et]",
        "source": "H853 (KJV: and; ESV: and; NASB: and)"
      },
      {
        "position": 26,
        "surface": "כָּל",
        "phrase": "all",
        "literal": "all",
        "source": "H3605 (KJV: all; ESV: all; NASB: all)"
      },
      {
        "position": 27,
        "surface": "כִּנְר֔וֹת",
        "phrase": "Kinnereth",
        "literal": "Kinnereths",
        "source": "H3672 (KJV: Kinneroth; ESV: Chinnereth; NASB: Kinnereth)"
      },
      {
        "position": 28,
        "surface": "עַ֖ל",
        "phrase": "beside",
        "literal": "upon",
        "source": "H5921 (KJV: with; ESV: and; NASB: and)"
      },
      {
        "position": 29,
        "surface": "כָּל",
        "phrase": "all",
        "literal": "all",
        "source": "H3605 (KJV: all; ESV: all; NASB: all)"
      },
      {
        "position": 30,
        "surface": "אֶ֥רֶץ",
        "phrase": "land of",
        "literal": "land-of",
        "source": "H776 (KJV: land; ESV: land; NASB: land)"
      },
      {
        "position": 31,
        "surface": "נַפְתָּלִֽי",
        "phrase": "Naphtali",
        "literal": "Naphtali",
        "source": "H5321 (KJV: Naphtali; ESV: Naphtali; NASB: Naphtali)"
      }
    ]
  }
]
