[
  {
    "book": "2 Kings",
    "chapter": 19,
    "verse": 9,
    "language_code": "en",
    "language_name": "English",
    "words": [
      {
        "position": 1,
        "surface": "וַ/יִּשְׁמַ֗ע",
        "phrase": "and he heard",
        "literal": "and-he-heard",
        "source": "H8085 (KJV: heard; ESV: heard; NASB: heard)"
      },
      {
        "position": 2,
        "surface": "אֶל",
        "phrase": "say of",
        "literal": "to",
        "source": "H413 (KJV: say of; ESV: concerning; NASB: them say concerning)"
      },
      {
        "position": 3,
        "surface": "תִּרְהָ֤קָה",
        "phrase": "Tirhakah",
        "literal": "Tirhakah",
        "source": "H8640 (KJV: Tirhakah; ESV: Tirhakah; NASB: Tirhakah)"
      },
      {
        "position": 4,
        "surface": "מֶֽלֶך",
        "phrase": "king",
        "literal": "king",
        "source": "H4428 (KJV: king; ESV: king; NASB: king)"
      },
      {
        "position": 5,
        "surface": "כּוּשׁ֙",
        "phrase": "of Cush",
        "literal": "Cush",
        "source": "H3568 (KJV: Ethiopia; ESV: Cush; NASB: Cush)"
      },
      {
        "position": 6,
        "surface": "לֵ/אמֹ֔ר",
        "phrase": "saying",
        "literal": "to-say",
        "source": "H559 (KJV: saying; ESV: saying; NASB: saying)"
      },
      {
        "position": 7,
        "surface": "הִנֵּ֥ה",
        "phrase": "behold",
        "literal": "behold",
        "source": "H2009 (KJV: Behold; ESV: Behold; NASB: Behold)"
      },
      {
        "position": 8,
        "surface": "יָצָ֖א",
        "phrase": "he has come out",
        "literal": "he-went-out",
        "source": "H3318 (KJV: he is come out; ESV: he has set out; NASB: he has come out)"
      },
      {
        "position": 9,
        "surface": "לְ/הִלָּחֵ֣ם",
        "phrase": "to fight",
        "literal": "to-fight",
        "source": "H3898 (KJV: to fight; ESV: to fight; NASB: to fight)"
      },
      {
        "position": 10,
        "surface": "אִתָּ֑/ךְ",
        "phrase": "against you",
        "literal": "with-you",
        "source": "H854 (KJV: against thee; ESV: against you; NASB: against you)"
      },
      {
        "position": 11,
        "surface": "וַ/יָּ֨שָׁב֙",
        "phrase": "and he turned back",
        "literal": "and-he-returned",
        "source": "H7725 (KJV: he sent messengers again [contextual]; ESV: he sent; NASB: he sent)"
      },
      {
        "position": 12,
        "surface": "וַ/יִּשְׁלַ֣ח",
        "phrase": "and he sent",
        "literal": "and-he-sent",
        "source": "H7971 (KJV: he sent messengers; ESV: he sent; NASB: he sent)"
      },
      {
        "position": 13,
        "surface": "מַלְאָכִ֔ים",
        "phrase": "messengers",
        "literal": "messengers",
        "source": "H4397 (KJV: messengers; ESV: messengers; NASB: messengers)"
      },
      {
        "position": 14,
        "surface": "אֶל",
        "phrase": "to",
        "literal": "to",
        "source": "H413 (KJV: unto; ESV: to; NASB: to)"
      },
      {
        "position": 15,
        "surface": "חִזְקִיָּ֖הוּ",
        "phrase": "Hezekiah",
        "literal": "Hezekiah",
        "source": "H2396 (KJV: Hezekiah; ESV: Hezekiah; NASB: Hezekiah)"
      },
      {
        "position": 16,
        "surface": "לֵ/אמֹֽר",
        "phrase": "saying",
        "literal": "to-say",
        "source": "H559 (KJV: saying; ESV: saying; NASB: saying)"
      }
    ]
  }
]
